### ISSUE TITLE
can not resolve host names

### ISSUE THREAD

**Issue by Vad1mo** [tonistiigi/dnsdock#7]
I am using https://vagrantcloud.com/yungsang/boxes/boot2docker with two modifications 

```
  config.vm.provider "virtualbox" do |v|
    v.memory = 2048
    v.cpus = 4
    v.customize ["modifyvm", :id, "--nicpromisc2", "allow-all"]
  end

  config.vm.network "private_network", ip: "192.168.10.11"
```

I added the needed entries for the docker daemon `config.vm.provision :shell, inline: "echo EXTRA_ARGS='--bip=172.17.42.1/16 --dns 172.17.42.1' > /var/lib/boot2docker/profile && cat /var/lib/boot2docker/profile"`

and started dnsdock
```
  config.vm.provision :docker do |d|
    d.run "dnsdock",
      image: "tonistiigi/dnsdock",
      args: "--name dnsdock -v /var/run/docker.sock:/var/run/docker.sock -p 172.17.42.1:53:53/udp -p 8080:80"
```

When I call  dig *.docker from inside an container e.g. zservice I get nothing until I add @172.17.42.1 
What I also see is that there is this nameserver in the zservice container.
```
root@z-service:/# cat /etc/resolv.conf
nameserver 10.0.2.3
root@z-service:/# dig @172.17.42.1 docker

; <<>> DiG 9.9.5-8-Debian <<>> @172.17.42.1 docker
; (1 server found)
;; global options: +cmd
;; Got answer:
;; ->>HEADER<<- opcode: QUERY, status: NOERROR, id: 57080
;; flags: qr rd; QUERY: 1, ANSWER: 7, AUTHORITY: 0, ADDITIONAL: 0
;; WARNING: recursion requested but not available

;; QUESTION SECTION:
;docker.				IN	A

;; ANSWER SECTION:
docker.			0	IN	A	172.17.0.157
docker.			0	IN	A	172.17.0.158
docker.			0	IN	A	172.17.0.159
docker.			0	IN	A	172.17.0.160
docker.			0	IN	A	172.17.0.161
docker.			0	IN	A	172.17.0.164
docker.			0	IN	A	172.17.0.156

;; Query time: 6 msec
;; SERVER: 172.17.42.1#53(172.17.42.1)
;; WHEN: Thu Jan 22 16:24:35 UTC 2015
;; MSG SIZE  rcvd: 178

root@z-service:/# 
```
Am I right that there should be the Ip Adress of DNSdock or the one of the gateway 172.17.42.1. 
So I wonder why is the nameserver not set correctly in the container?
```
    "NetworkSettings": {
        "Bridge": "docker0",
        "Gateway": "172.17.42.1",
        "IPAddress": "172.17.0.160",
        "IPPrefixLen": 16,
        "MacAddress": "02:42:ac:11:00:a0",
        "PortMapping": null,
        "Ports": {
            "8884/tcp": [
                {
                    "HostIp": "0.0.0.0",
                    "HostPort": "8884"
                }
            ]
        }
    },
```

**Comment by tonistiigi** [comment]
Something is probably wrong with the provisioner and `EXTRA_ARGS` isn't set up properly. Maybe the issue is that daemon isn't restarted after the profile file is changed.

If you run `docker run -it --rm busybox cat /etc/resolv.conf` you should see `nameserver 172.17.42.1` in the results. If you can't see that then the `EXTRA_ARGS` were not properly loaded.

**Comment by Vad1mo** [comment]
they where two issue It needed some quote magic so docker would accept the extra args 
  `config.vm.provision :shell, inline: "echo EXTRA_ARGS=\\\"--bip=#{DNS_ADDR}/16 --dns=#{DNS_ADDR}\\\" > /var/lib/boot2docker/profile"`

The second thing was the docker daemon was already running at that time so I needed to restart it. 
  `config.vm.provision :shell, inline: "/etc/init.d/docker restart"`

**Comment by Vad1mo** [comment]
Now I have a very strange issue 

Nginx is connection to a backend server:
```
location /api/ {
      proxy_pass              http://service:8888}/;
      proxy_set_header        Host $host;
....
```
 the nginx logs produce this 
015/01/23 14:33:08 [error] 12#0: *42 connect() failed (113: No route to host) while connecting to upstream, client: 192.168.10.1, server: dev, request: "GET /api/schema HTTP/1.1", upstream: "http://172.17.0.6:8888/schema", host: "dev.service.docker", referrer: "http://dev.service.docker/"

172.17.0.6 is the old address of the service but the service was already restarted and now has a new ip 
172.17.0.15 

when i ping service.docker i get the new address but nginx is still having the old one. Also my all other services can deal with new ip addresses of services. does it have to do with ttl?

**Comment by tonistiigi** [comment]
Nginx does some internal caching. See https://github.com/crosbymichael/skydock/pull/29 and https://github.com/tonistiigi/dnsdock/issues/2

Or run `docker kill -s HUP nginx` to clear the cache.

**Comment by Vad1mo** [comment]
Thx for this info I am step further.

I have created this nginx conf file which according to various source considers the TTL and is dynamic.

```
resolver 172.17.42.1; #use dnsdock to resolve hostname to ip dynamic.

Not I get this error: `zi-service.docker could not be resolved (110: Operation timed out),``

I tied to set backend as  `set $backend "http://zi-service.docker:8884/"`and ` set $backend "http://zi-service:8884/"` because nginx does not have an option for search domain.

```
server {
  listen 80;
  server_name ${HOSTNAME};

  location / {
    autoindex on;
    root  /app/;
  }

  location /api/ {      
      set $backend "http://zi-service:8884/"; # set in variable as they are evaluated dynamic at runtime and not at config.
      proxy_pass              $backend;
      proxy_set_header        Host $host;
      proxy_set_header        X-Real-IP $remote_addr;
      proxy_set_header        X-Forwarded-For $proxy_add_x_forwarded_for;
      proxy_connect_timeout   150;
      proxy_send_timeout      100;
      proxy_read_timeout      100;
      proxy_buffers           16 64k;
      proxy_busy_buffers_size 64k;
      client_max_body_size    256k;
      client_body_buffer_size 128k;
  }
}
```

I did a `root@dev:/# tcpdump -i eth0 port 53 ` on nginx and this happens. So I am stuck and don't know if thats an nginx issue or dnsdock?

```
16:38:59.493540 IP dev.39780 > 172.42.17.1.domain: 49553+ A? zi-service.docker. (48)
16:38:59.493657 IP dev.39780 > 172.42.17.1.domain: 6496+ AAAA? zi-service.docker. (48)
16:38:59.494324 IP dev.56602 > 172.17.42.1.domain: 931+ PTR? 1.17.42.172.in-addr.arpa. (42)
16:38:59.529334 IP 172.17.42.1.domain > dev.56602: 931 NXDomain 0/1/0 (120)
16:38:59.529812 IP dev.50147 > 172.17.42.1.domain: 50142+ PTR? 1.42.17.172.in-addr.arpa. (42)
16:38:59.545354 IP 172.17.42.1.domain > dev.50147: 50142 NXDomain 0/0/0 (42)
```

**Comment by Vad1mo** [comment]
I looked again at the docs and changed the format as following this scheme.
<anything>.<container-name>.<image-name>.<environment>.<domain>
In my case the FQDN is `zi-service.zi-service.docker` when changed this is the error.

```
2015/01/25 17:38:24 [error] 16#0: unexpected RR type 6
2015/01/25 17:38:24 [error] 16#0: no A or CNAME types in DNS response
```
After comparing my setup with https://github.com/crosbymichael/skydock/pull/29 and verified it is the same I am now stuck same as #2

**Comment by tonistiigi** [comment]
#2 should be fixed. I think you mean #4, but I though that was only about the logs.

The issue is (imho) that dnsdock only supports A requests. Nginx also sends other requests and there is something wrong with responding to them with an error. It would really help if you could set up docker images or dockerfiles that reproduce the issue. Also include `docker version` and `docker info`. Last time I checked #4 I could not reproduce it.

**Comment by tonistiigi** [comment]
Can you also reproduce the stalling if you use ` resolver 172.17.44.1 valid=0s;` in nginx conf? I can't then.

The errors in the logs shouldn't be too critical as they are for unsupported requests. I need to test more with other clients until I feel comfortable with changing the response for these requests.

**Comment by Vad1mo** [comment]
I tried it again and now it works. 

```
resolver 172.17.42.1; #use dnsdock to resolve hostname to IPs dynamically TTL is set by Dnsdock
resolver_timeout 10s;
server {
  listen 80;
  server_name ${HOSTNAME};

  location / {
    autoindex on;
    root  /app/zwebapp/;
  }
  location /api/ {      
      set $backend zservice.docker;
      proxy_pass              http://$backend:8884;      
     ....
``
